Id,Full Name,Address,Age,Cities,Schools,Colleges,CurrentOrganization,PastOrganizations,Interests
NCE00001,Muriel Lulu Casper II,75826 Lesch Stravenue,42,Mumbai,Seventh Day Adventist School,Indira School Of Communication Acting Academy,Apollo Tyres,,Art|Sports|Yoga|Writing
NCE00002,Rosella Garth Nienow IV,6007 Lydia Pike,37,Bangalore|Delhi,Delhi Public School,Arihant College Of Arts Commerce & Science ACACS,Ambuja Cements,Aptech|Aditya Birla Group|Amul,Reading|Music|Yoga
NCE00003,Kenna Fadel,572 Kuvalis Manors,35,Bangalore,GK Gurukul|Seventh Day Adventist School,,Air India,Apollo Tyres,Volunteering|Travel|Marketing|Dance
NCE00004,Lemuel Hartmann,8691 Madisyn Dale,42,Mumbai|Delhi,P.k International English school|Jawahar Navodaya Vidyalaya|Rajkiya Ashram Paddhati Vidyalaya,,Air Costa,Aban Offshore|Aditya Birla Group|Amrutanjan Healthcare|Aptech,Yoga
NCE00005,Johnny Mohr,0957 Simonis Courts,29,Mumbai|Bangalore,Jawahar Navodaya Vidyalaya|Challenger Public School|P.k International English school,,Air India Express,Ambuja Cements,Music|Sports
NCE00006,Ollie Kuhn MD,225 Caesar Run,46,,Kendriya Vidyalaya|Sainik School,Indira School Of Science,Air Odisha,Adani Group,Podcasting
